[{"aspectId":"landscape","findings":[{"code":"low-contrast","severity":"BLOCK","slotId":"chips-note"}],"frame":184,"kind":"frame_observation","regions":[{"box":{"height":101.1875,"width":639.359375,"x":96,"y":297},"regionId":"chips-note"}],"renderId":"render-4e856c8f09370c1cf27c8674f0d5ea004f94cf75cf9d4d57","schemaVersion":"3.0.0","texts":[{"box":{"height":101.1875,"width":639.359375,"x":96,"y":297},"clipped":false,"contrastRatio":3.324836041798544,"covered":false,"fallbackUsed":false,"fonts":[{"family":"Geist SemiBold","glyphCount":32}],"insideSafeArea":true,"largeText":true,"missingGlyphs":0,"slotId":"chips-note","text":"Where tasks begin · same preview"}]},{"aspectId":"landscape","findings":[{"code":"low-contrast","severity":"BLOCK","slotId":"grid-attribution"},{"code":"low-contrast","severity":"BLOCK","slotId":"feat-modes"},{"code":"low-contrast","severity":"BLOCK","slotId":"feat-agents"},{"code":"low-contrast","severity":"BLOCK","slotId":"feat-creation"},{"code":"low-contrast","severity":"BLOCK","slotId":"feat-creation-sub"}],"frame":250,"kind":"frame_observation","regions":[{"box":{"height":50.59375,"width":1728,"x":96,"y":54},"regionId":"grid-attribution"},{"box":{"height":101.1875,"width":478.15625,"x":136.90625,"y":382.484375},"regionId":"feat-modes"},{"box":{"height":101.1875,"width":478.15625,"x":720.90625,"y":382.484375},"regionId":"feat-agents"},{"box":{"height":101.1875,"width":478.15625,"x":1304.90625,"y":382.484375},"regionId":"feat-creation"},{"box":{"height":101.1875,"width":478.15625,"x":1304.90625,"y":723.453125},"regionId":"feat-creation-sub"}],"renderId":"render-4e856c8f09370c1cf27c8674f0d5ea004f94cf75cf9d4d57","schemaVersion":"3.0.0","texts":[{"box":{"height":50.59375,"width":1728,"x":96,"y":54},"clipped":false,"contrastRatio":3.324836041798544,"covered":false,"fallbackUsed":false,"fonts":[{"family":"Geist SemiBold","glyphCount":36}],"insideSafeArea":true,"largeText":true,"missingGlyphs":0,"slotId":"grid-attribution","text":"As described on the MiniMax homepage"},{"box":{"height":101.1875,"width":478.15625,"x":136.90625,"y":382.484375},"clipped":false,"contrastRatio":3.324836041798544,"covered":false,"fallbackUsed":false,"fonts":[{"family":"Geist SemiBold","glyphCount":21}],"insideSafeArea":true,"largeText":true,"missingGlyphs":0,"slotId":"feat-modes","text":"Coding and Work modes"},{"box":{"height":101.1875,"width":478.15625,"x":720.90625,"y":382.484375},"clipped":false,"contrastRatio":3.324836041798544,"covered":false,"fallbackUsed":false,"fonts":[{"family":"Geist SemiBold","glyphCount":23}],"insideSafeArea":true,"largeText":true,"missingGlyphs":0,"slotId":"feat-agents","text":"Agents team up on tasks"},{"box":{"height":101.1875,"width":478.15625,"x":1304.90625,"y":382.484375},"clipped":false,"contrastRatio":3.324836041798544,"covered":false,"fallbackUsed":false,"fonts":[{"family":"Geist SemiBold","glyphCount":23}],"insideSafeArea":true,"largeText":true,"missingGlyphs":0,"slotId":"feat-creation","text":"Images, video and audio"},{"box":{"height":101.1875,"width":478.15625,"x":1304.90625,"y":723.453125},"clipped":false,"contrastRatio":3.324836041798544,"covered":false,"fallbackUsed":false,"fonts":[{"family":"Geist SemiBold","glyphCount":26}],"insideSafeArea":true,"largeText":true,"missingGlyphs":0,"slotId":"feat-creation-sub","text":"Scripts and voiceovers too"}]},{"aspectId":"landscape","findings":[{"code":"low-contrast","severity":"BLOCK","slotId":"grid-attribution"},{"code":"low-contrast","severity":"BLOCK","slotId":"feat-modes"},{"code":"low-contrast","severity":"BLOCK","slotId":"feat-agents"},{"code":"low-contrast","severity":"BLOCK","slotId":"feat-creation"},{"code":"low-contrast","severity":"BLOCK","slotId":"feat-creation-sub"}],"frame":274,"kind":"frame_observation","regions":[{"box":{"height":50.59375,"width":1728,"x":96,"y":54},"regionId":"grid-attribution"},{"box":{"height":101.1875,"width":478.15625,"x":136.90625,"y":382.484375},"regionId":"feat-modes"},{"box":{"height":101.1875,"width":478.15625,"x":720.90625,"y":382.484375},"regionId":"feat-agents"},{"box":{"height":101.1875,"width":478.15625,"x":1304.90625,"y":382.484375},"regionId":"feat-creation"},{"box":{"height":101.1875,"width":478.15625,"x":1304.90625,"y":723.453125},"regionId":"feat-creation-sub"}],"renderId":"render-4e856c8f09370c1cf27c8674f0d5ea004f94cf75cf9d4d57","schemaVersion":"3.0.0","texts":[{"box":{"height":50.59375,"width":1728,"x":96,"y":54},"clipped":false,"contrastRatio":3.324836041798544,"covered":false,"fallbackUsed":false,"fonts":[{"family":"Geist SemiBold","glyphCount":36}],"insideSafeArea":true,"largeText":true,"missingGlyphs":0,"slotId":"grid-attribution","text":"As described on the MiniMax homepage"},{"box":{"height":101.1875,"width":478.15625,"x":136.90625,"y":382.484375},"clipped":false,"contrastRatio":3.324836041798544,"covered":false,"fallbackUsed":false,"fonts":[{"family":"Geist SemiBold","glyphCount":21}],"insideSafeArea":true,"largeText":true,"missingGlyphs":0,"slotId":"feat-modes","text":"Coding and Work modes"},{"box":{"height":101.1875,"width":478.15625,"x":720.90625,"y":382.484375},"clipped":false,"contrastRatio":3.324836041798544,"covered":false,"fallbackUsed":false,"fonts":[{"family":"Geist SemiBold","glyphCount":23}],"insideSafeArea":true,"largeText":true,"missingGlyphs":0,"slotId":"feat-agents","text":"Agents team up on tasks"},{"box":{"height":101.1875,"width":478.15625,"x":1304.90625,"y":382.484375},"clipped":false,"contrastRatio":3.324836041798544,"covered":false,"fallbackUsed":false,"fonts":[{"family":"Geist SemiBold","glyphCount":23}],"insideSafeArea":true,"largeText":true,"missingGlyphs":0,"slotId":"feat-creation","text":"Images, video and audio"},{"box":{"height":101.1875,"width":478.15625,"x":1304.90625,"y":723.453125},"clipped":false,"contrastRatio":3.324836041798544,"covered":false,"fallbackUsed":false,"fonts":[{"family":"Geist SemiBold","glyphCount":26}],"insideSafeArea":true,"largeText":true,"missingGlyphs":0,"slotId":"feat-creation-sub","text":"Scripts and voiceovers too"}]}]