[{"aspectId":"landscape","findings":[{"code":"low-contrast","severity":"BLOCK","slotId":"cta-main"},{"code":"low-contrast","severity":"BLOCK","slotId":"cta-url"}],"frame":378,"kind":"frame_observation","regions":[{"box":{"height":189.1875,"width":1728,"x":96,"y":345.59375},"regionId":"cta-main"},{"box":{"height":50.59375,"width":1728,"x":96,"y":831.59375},"regionId":"cta-url"}],"renderId":"render-4e856c8f09370c1cf27c8674f0d5ea004f94cf75cf9d4d57","schemaVersion":"3.0.0","texts":[{"box":{"height":189.1875,"width":1728,"x":96,"y":345.59375},"clipped":false,"contrastRatio":3.324836041798544,"covered":false,"fallbackUsed":false,"fonts":[{"family":"Geist SemiBold","glyphCount":20}],"insideSafeArea":true,"largeText":true,"missingGlyphs":0,"slotId":"cta-main","text":"Explore MiniMax Code"},{"box":{"height":50.59375,"width":1728,"x":96,"y":831.59375},"clipped":false,"contrastRatio":3.324836041798544,"covered":false,"fallbackUsed":false,"fonts":[{"family":"Geist SemiBold","glyphCount":16}],"insideSafeArea":true,"largeText":true,"missingGlyphs":0,"slotId":"cta-url","text":"agent.minimax.io"}]},{"aspectId":"landscape","findings":[{"code":"low-contrast","severity":"BLOCK","slotId":"cta-main"},{"code":"low-contrast","severity":"BLOCK","slotId":"cta-url"}],"frame":390,"kind":"frame_observation","regions":[{"box":{"height":189.1875,"width":1728,"x":96,"y":345.59375},"regionId":"cta-main"},{"box":{"height":50.59375,"width":1728,"x":96,"y":831.59375},"regionId":"cta-url"}],"renderId":"render-4e856c8f09370c1cf27c8674f0d5ea004f94cf75cf9d4d57","schemaVersion":"3.0.0","texts":[{"box":{"height":189.1875,"width":1728,"x":96,"y":345.59375},"clipped":false,"contrastRatio":3.324836041798544,"covered":false,"fallbackUsed":false,"fonts":[{"family":"Geist SemiBold","glyphCount":20}],"insideSafeArea":true,"largeText":true,"missingGlyphs":0,"slotId":"cta-main","text":"Explore MiniMax Code"},{"box":{"height":50.59375,"width":1728,"x":96,"y":831.59375},"clipped":false,"contrastRatio":3.324836041798544,"covered":false,"fallbackUsed":false,"fonts":[{"family":"Geist SemiBold","glyphCount":16}],"insideSafeArea":true,"largeText":true,"missingGlyphs":0,"slotId":"cta-url","text":"agent.minimax.io"}]}]