[{"aspectId":"landscape","findings":[{"code":"low-contrast","severity":"BLOCK","slotId":"hook-headline"},{"code":"low-contrast","severity":"BLOCK","slotId":"hook-sub"}],"frame":44,"kind":"frame_observation","regions":[{"box":{"height":189.1875,"width":1728,"x":96,"y":287.265625},"regionId":"hook-headline"},{"box":{"height":50.59375,"width":1589.75,"x":96,"y":841.3125},"regionId":"hook-sub"}],"renderId":"render-4e856c8f09370c1cf27c8674f0d5ea004f94cf75cf9d4d57","schemaVersion":"3.0.0","texts":[{"box":{"height":189.1875,"width":1728,"x":96,"y":287.265625},"clipped":false,"contrastRatio":3.324836041798544,"covered":false,"fallbackUsed":false,"fonts":[{"family":"Geist SemiBold","glyphCount":18}],"insideSafeArea":true,"largeText":true,"missingGlyphs":0,"slotId":"hook-headline","text":"Start with a goal."},{"box":{"height":50.59375,"width":1589.75,"x":96,"y":841.3125},"clipped":false,"contrastRatio":3.324836041798544,"covered":false,"fallbackUsed":false,"fonts":[{"family":"Geist SemiBold","glyphCount":12}],"insideSafeArea":true,"largeText":true,"missingGlyphs":0,"slotId":"hook-sub","text":"MiniMax Code"}]},{"aspectId":"landscape","findings":[{"code":"low-contrast","severity":"BLOCK","slotId":"input-note"}],"frame":104,"kind":"frame_observation","regions":[{"box":{"height":101.1875,"width":639.359375,"x":96,"y":297},"regionId":"input-note"}],"renderId":"render-4e856c8f09370c1cf27c8674f0d5ea004f94cf75cf9d4d57","schemaVersion":"3.0.0","texts":[{"box":{"height":101.1875,"width":639.359375,"x":96,"y":297},"clipped":false,"contrastRatio":3.324836041798544,"covered":false,"fallbackUsed":false,"fonts":[{"family":"Geist SemiBold","glyphCount":32}],"insideSafeArea":true,"largeText":true,"missingGlyphs":0,"slotId":"input-note","text":"Type the goal · official preview"}]}]